{
  "$schema": "https://json-schema.org/draft/2020-12/schema",
  "type": "object",
  "properties": {
    "$schema": {
      "type": "string"
    },
    "version": {
      "type": "string",
      "minLength": 1
    },
    "prices": {
      "type": "object",
      "properties": {
        "small": {
          "type": "object",
          "properties": {
            "input": {
              "type": "number",
              "minimum": 0
            },
            "cachedInput": {
              "type": "number",
              "minimum": 0
            },
            "cacheWrite": {
              "type": "number",
              "minimum": 0
            },
            "output": {
              "type": "number",
              "minimum": 0
            }
          },
          "required": [
            "input",
            "cachedInput",
            "cacheWrite",
            "output"
          ],
          "additionalProperties": false
        },
        "large": {
          "type": "object",
          "properties": {
            "input": {
              "type": "number",
              "minimum": 0
            },
            "cachedInput": {
              "type": "number",
              "minimum": 0
            },
            "cacheWrite": {
              "type": "number",
              "minimum": 0
            },
            "output": {
              "type": "number",
              "minimum": 0
            }
          },
          "required": [
            "input",
            "cachedInput",
            "cacheWrite",
            "output"
          ],
          "additionalProperties": false
        }
      },
      "required": [
        "small",
        "large"
      ],
      "additionalProperties": false
    },
    "hysteresis": {
      "type": "number",
      "minimum": 0,
      "exclusiveMaximum": 1
    },
    "stepTokens": {
      "type": "number",
      "exclusiveMinimum": 0
    },
    "routine": {
      "type": "object",
      "properties": {
        "instructions": {
          "type": "string",
          "minLength": 1
        },
        "levels": {
          "minItems": 2,
          "type": "array",
          "items": {
            "type": "string",
            "minLength": 1
          }
        }
      },
      "required": [
        "instructions",
        "levels"
      ],
      "additionalProperties": false
    },
    "stretch": {
      "type": "array",
      "items": {
        "type": "number",
        "minimum": 0
      }
    },
    "protect": {
      "$ref": "#/$defs/__schema0"
    },
    "derive": {
      "type": "object",
      "propertyNames": {
        "type": "string",
        "minLength": 1
      },
      "additionalProperties": {
        "minItems": 1,
        "type": "array",
        "items": {
          "type": "string",
          "pattern": "^[a-z0-9]+$"
        }
      }
    }
  },
  "required": [
    "version",
    "prices",
    "hysteresis",
    "stepTokens",
    "routine",
    "stretch",
    "protect"
  ],
  "additionalProperties": false,
  "$defs": {
    "__schema0": {
      "anyOf": [
        {
          "type": "object",
          "properties": {
            "all": {
              "type": "array",
              "items": {
                "$ref": "#/$defs/__schema0"
              }
            }
          },
          "required": [
            "all"
          ],
          "additionalProperties": false
        },
        {
          "type": "object",
          "properties": {
            "any": {
              "type": "array",
              "items": {
                "$ref": "#/$defs/__schema0"
              }
            }
          },
          "required": [
            "any"
          ],
          "additionalProperties": false
        },
        {
          "type": "object",
          "properties": {
            "not": {
              "$ref": "#/$defs/__schema0"
            }
          },
          "required": [
            "not"
          ],
          "additionalProperties": false
        },
        {
          "type": "object",
          "properties": {
            "eq": {
              "type": "array",
              "prefixItems": [
                {
                  "type": "string",
                  "minLength": 1
                },
                {
                  "$ref": "#/$defs/__schema1"
                }
              ],
              "items": false,
              "minItems": 2,
              "maxItems": 2
            }
          },
          "required": [
            "eq"
          ],
          "additionalProperties": false
        },
        {
          "type": "object",
          "properties": {
            "in": {
              "type": "array",
              "prefixItems": [
                {
                  "type": "string",
                  "minLength": 1
                },
                {
                  "type": "array",
                  "items": {
                    "$ref": "#/$defs/__schema1"
                  }
                }
              ],
              "items": false,
              "minItems": 2,
              "maxItems": 2
            }
          },
          "required": [
            "in"
          ],
          "additionalProperties": false
        },
        {
          "type": "object",
          "properties": {
            "gte": {
              "type": "array",
              "prefixItems": [
                {
                  "type": "string",
                  "minLength": 1
                },
                {
                  "type": "number"
                }
              ],
              "items": false,
              "minItems": 2,
              "maxItems": 2
            }
          },
          "required": [
            "gte"
          ],
          "additionalProperties": false
        },
        {
          "type": "object",
          "properties": {
            "lte": {
              "type": "array",
              "prefixItems": [
                {
                  "type": "string",
                  "minLength": 1
                },
                {
                  "type": "number"
                }
              ],
              "items": false,
              "minItems": 2,
              "maxItems": 2
            }
          },
          "required": [
            "lte"
          ],
          "additionalProperties": false
        },
        {
          "type": "object",
          "properties": {
            "prefix": {
              "type": "array",
              "prefixItems": [
                {
                  "type": "string",
                  "minLength": 1
                },
                {
                  "type": "string"
                }
              ],
              "items": false,
              "minItems": 2,
              "maxItems": 2
            }
          },
          "required": [
            "prefix"
          ],
          "additionalProperties": false
        },
        {
          "type": "object",
          "properties": {
            "suffix": {
              "type": "array",
              "prefixItems": [
                {
                  "type": "string",
                  "minLength": 1
                },
                {
                  "type": "string"
                }
              ],
              "items": false,
              "minItems": 2,
              "maxItems": 2
            }
          },
          "required": [
            "suffix"
          ],
          "additionalProperties": false
        },
        {
          "type": "object",
          "properties": {
            "contains": {
              "type": "array",
              "prefixItems": [
                {
                  "type": "string",
                  "minLength": 1
                },
                {
                  "type": "string"
                }
              ],
              "items": false,
              "minItems": 2,
              "maxItems": 2
            }
          },
          "required": [
            "contains"
          ],
          "additionalProperties": false
        },
        {
          "type": "object",
          "properties": {
            "exists": {
              "type": "string",
              "minLength": 1
            }
          },
          "required": [
            "exists"
          ],
          "additionalProperties": false
        }
      ]
    },
    "__schema1": {
      "anyOf": [
        {
          "type": "string"
        },
        {
          "type": "number"
        },
        {
          "type": "boolean"
        },
        {
          "type": "null"
        },
        {
          "type": "array",
          "items": {
            "$ref": "#/$defs/__schema1"
          }
        },
        {
          "type": "object",
          "propertyNames": {
            "type": "string"
          },
          "additionalProperties": {
            "$ref": "#/$defs/__schema1"
          }
        }
      ]
    }
  }
}
